{
  "id": "observation-uber-nuro-lucid-houston-robotaxi",
  "slug": "uber-nuro-lucid-houston-robotaxi",
  "status": "published",
  "level": "brief",
  "nature": "evidence-led",
  "title": "Uber、Nuro与Lucid计划2027年在休斯顿推出Robotaxi",
  "summary": "Uber、Nuro与Lucid宣布计划于2027年在休斯顿推出Robotaxi服务，当前仍是合作与测试准备，不代表商业服务已经启动。",
  "companies": [
    "Uber",
    "Nuro",
    "Lucid"
  ],
  "regions": [
    "美国休斯顿"
  ],
  "dimensions": [
    "合作与扩张",
    "运营与市场"
  ],
  "primaryDimension": "合作与扩张",
  "eventAt": "2026-06-17",
  "publishedAt": "2026-08-02",
  "updatedAt": "2026-08-02",
  "factOverview": [
    {
      "label": "合作计划",
      "value": "2027年休斯顿Robotaxi服务"
    },
    {
      "label": "车辆方向",
      "value": "Lucid Gravity平台"
    },
    {
      "label": "当前阶段",
      "value": "监督测试与运营设施准备"
    }
  ],
  "rangeAndFacts": {
    "id": "range-and-facts",
    "heading": "范围与事实",
    "paragraphs": [
      "Uber官方公告称将与Nuro、Lucid于2027年在休斯顿带来Robotaxi服务；Nuro将在休斯顿和旧金山开展监督测试，Uber已取得休斯顿车队运营设施。"
    ],
    "evidenceUnitIds": [
      "evidence-uber-houston-robotaxi-plan"
    ]
  },
  "operatingImpact": {
    "id": "operating-impact",
    "heading": "经营影响",
    "paragraphs": [
      "该合作把自动驾驶系统、车辆平台和车队运营设施放进同一城市部署计划，值得跟踪其从监督测试到商业服务的转化；具体日期、许可、车辆数量和收费方案仍未确认。"
    ],
    "evidenceUnitIds": [
      "evidence-uber-houston-robotaxi-plan"
    ]
  },
  "evidenceUnits": [
    {
      "id": "evidence-uber-houston-robotaxi-plan",
      "claim": "Uber官方公告称将与Nuro、Lucid于2027年在休斯顿带来Robotaxi服务，Nuro将在休斯顿和旧金山开展监督测试，Uber已取得休斯顿车队运营设施。",
      "claimKind": "company_statement",
      "sourceRefs": [
        "source-uber-houston-2026"
      ]
    }
  ],
  "sources": [
    {
      "id": "source-uber-houston-2026",
      "publisher": "Uber Investor Relations",
      "title": "Uber, Nuro and Lucid to Bring Robotaxi Service to Houston in 2027",
      "url": "https://investor.uber.com/news-events/news/press-release-details/2026/Uber-Nuro-and-Lucid-to-Bring-Robotaxi-Service-to-Houston-in-2027/default.aspx",
      "publishedAt": "2026-06-17",
      "sourceTier": "official",
      "sourceType": "official_statement",
      "accessedAt": "2026-08-02"
    }
  ],
  "sections": [],
  "evidenceBoundary": "仅证明官方合作及计划，不证明休斯顿已开始载客或已获得全部许可。",
  "relatedWorks": [
    "robotaxi"
  ],
  "promoteToHome": false,
  "presentation": "brief",
  "brief": {
    "subject": "休斯顿Robotaxi计划",
    "body": "Uber、Nuro与Lucid宣布计划于2027年在休斯顿推出Robotaxi服务，Nuro将先开展监督测试，Uber准备车队运营设施，Lucid提供Gravity车辆平台。这个合作把技术、车辆和运营基础设施放进同一城市计划，但仍属于前瞻部署，不代表休斯顿已经开始载客，具体许可、车辆数量和收费方案尚未确认。",
    "sourceRefs": [
      "source-uber-houston-2026"
    ],
    "isOpinion": false
  }
}
