{
  "id": "observation-pony-ai-q1-2026-robotaxi-update",
  "slug": "pony-ai-q1-2026-robotaxi-update",
  "status": "published",
  "level": "standard",
  "nature": "evidence-led",
  "title": "Pony.ai披露一季度Robotaxi服务收入与生产规模",
  "summary": "Pony.ai披露一季度Robotaxi服务收入857万美元，并更新生产规模和全年目标。",
  "companies": [
    "Pony.ai"
  ],
  "regions": [
    "中国及海外"
  ],
  "dimensions": [
    "经营与资本",
    "运营与市场"
  ],
  "primaryDimension": "经营与资本",
  "eventAt": "2026-05-26",
  "publishedAt": "2026-07-30",
  "updatedAt": "2026-07-30",
  "factOverview": [
    {
      "label": "一季度Robotaxi服务收入",
      "value": "857万美元"
    },
    {
      "label": "同比",
      "value": "增长395.4%"
    },
    {
      "label": "截至5月24日生产量",
      "value": "1,776辆"
    }
  ],
  "rangeAndFacts": {
    "id": "range-and-facts",
    "heading": "范围与事实",
    "paragraphs": [
      "Pony.ai披露一季度Robotaxi服务收入为857万美元，同比增长395.4%，其中付费运营收入同比增长456.5%；截至5月24日已生产1,776辆Robotaxi。"
    ],
    "evidenceUnitIds": [
      "evidence-pony-revenue",
      "evidence-pony-production"
    ]
  },
  "operatingImpact": {
    "id": "operating-impact",
    "heading": "经营影响",
    "paragraphs": [
      "这是直接按Robotaxi服务披露的收入指标，但全年收入和车队规模仍是前瞻目标，生产车辆也不等于已部署或投入收费运营。"
    ],
    "evidenceUnitIds": [
      "evidence-pony-target-boundary"
    ]
  },
  "evidenceUnits": [
    {
      "id": "evidence-pony-revenue",
      "claim": "Pony.ai披露2026年第一季度Robotaxi服务收入为857万美元，同比增长395.4%；其中付费运营收入同比增长456.5%。",
      "claimKind": "company_statement",
      "sourceRefs": [
        "source-pony-q1-2026"
      ]
    },
    {
      "id": "evidence-pony-production",
      "claim": "Pony.ai披露截至2026年5月24日已生产1,776辆Robotaxi。",
      "claimKind": "company_statement",
      "sourceRefs": [
        "source-pony-q1-2026"
      ]
    },
    {
      "id": "evidence-pony-target-boundary",
      "claim": "Pony.ai将全年Robotaxi收入和年末车队目标上调，但公司明确其为可能变化的前瞻目标。",
      "claimKind": "company_statement",
      "sourceRefs": [
        "source-pony-q1-2026"
      ]
    }
  ],
  "sources": [
    {
      "id": "source-pony-q1-2026",
      "publisher": "Pony AI Inc.",
      "title": "PONY AI Inc. Reports First Quarter 2026 Financial Results with Continued Growth in Robotaxi Revenues and Expanding Fleet Deployment",
      "url": "https://ir.pony.ai/news-releases/news-release-details/pony-ai-inc-reports-first-quarter-2026-financial-results",
      "publishedAt": "2026-05-26",
      "sourceTier": "official",
      "sourceType": "official_statement",
      "accessedAt": "2026-07-30"
    }
  ],
  "sections": [],
  "evidenceBoundary": "本条为公司未经审计披露；不把生产量写作已部署或收费运营车队，不把全年目标写作已实现结果，也不据此推断盈利或单位经济性。",
  "relatedWorks": [
    "robotaxi"
  ],
  "promoteToHome": false,
  "presentation": "brief",
  "brief": {
    "subject": "Pony.ai Robotaxi收入",
    "body": "Pony.ai披露一季度Robotaxi服务收入857万美元、同比增长395.4%，其中付费运营收入同比增长456.5%；截至5月24日已生产1,776辆Robotaxi。全年收入与年末车队数字均为前瞻目标，生产车辆也不等于全部已部署或投入收费运营。",
    "sourceRefs": [
      "source-pony-q1-2026"
    ],
    "isOpinion": false
  }
}
