{
  "id": "observation-zoox-smoke-scene-recall",
  "slug": "zoox-smoke-scene-recall",
  "status": "published",
  "level": "standard",
  "nature": "evidence-led",
  "title": "Zoox因浓烟应急场景问题召回105辆Robotaxi的软件",
  "summary": "一次火灾现场异常触发全车队软件更新，说明应急场景识别和远程异常处置是实际运营能力。",
  "companies": [
    "Zoox"
  ],
  "regions": [
    "美国"
  ],
  "dimensions": [
    "安全与事件",
    "产品与能力"
  ],
  "primaryDimension": "安全与事件",
  "eventAt": "2026-07-07",
  "publishedAt": "2026-07-28",
  "updatedAt": "2026-07-28",
  "factOverview": [
    {
      "label": "影响范围",
      "value": "105辆"
    },
    {
      "label": "触发事件",
      "value": "2026-06-20浓烟应急现场"
    },
    {
      "label": "召回决定",
      "value": "2026-07-07"
    }
  ],
  "rangeAndFacts": {
    "id": "range-and-facts",
    "heading": "范围与事实",
    "paragraphs": [
      "Zoox于7月7日决定对105辆车实施软件召回，以修复车辆在浓烟遮挡的火灾应急现场无法正确处理的问题；触发事件中车辆最终由远程操作员倒离现场，未报告人员受伤。"
    ],
    "evidenceUnitIds": [
      "evidence-zoox-recall",
      "evidence-zoox-event",
      "evidence-zoox-update"
    ]
  },
  "operatingImpact": {
    "id": "operating-impact",
    "heading": "经营影响",
    "paragraphs": [
      "召回显示应急场景识别直接影响全车队软件和监管信任；远程操作虽解除现场，但也构成实际运营能力的一部分。"
    ],
    "evidenceUnitIds": [
      "evidence-zoox-impact"
    ]
  },
  "evidenceUnits": [
    {
      "id": "evidence-zoox-recall",
      "claim": "NHTSA召回编号26E044000涉及Zoox的105辆车和浓烟应急场景软件问题。",
      "claimKind": "verified_fact",
      "sourceRefs": [
        "source-nhtsa-zoox",
        "source-techcrunch-zoox"
      ]
    },
    {
      "id": "evidence-zoox-event",
      "claim": "6月20日事件中无人受伤，远程操作员最终将车辆倒离现场。",
      "claimKind": "media_report",
      "sourceRefs": [
        "source-techcrunch-zoox"
      ]
    },
    {
      "id": "evidence-zoox-update",
      "claim": "Zoox称已向车队发送软件更新，增强对浓烟应急现场的识别和响应。",
      "claimKind": "company_statement",
      "sourceRefs": [
        "source-techcrunch-zoox"
      ]
    },
    {
      "id": "evidence-zoox-impact",
      "claim": "应急场景识别与远程异常处置会直接影响全车队运营和监管信任。",
      "claimKind": "inference",
      "sourceRefs": [
        "source-nhtsa-zoox",
        "source-techcrunch-zoox"
      ]
    }
  ],
  "sources": [
    {
      "id": "source-nhtsa-zoox",
      "publisher": "NHTSA",
      "title": "Recall 26E044000",
      "url": "https://www.nhtsa.gov/?nhtsaId=26E044000",
      "publishedAt": "2026-07-17",
      "sourceTier": "official",
      "sourceType": "report",
      "accessedAt": "2026-07-27"
    },
    {
      "id": "source-techcrunch-zoox",
      "publisher": "TechCrunch",
      "title": "Zoox issues software recall after a robotaxi got confused by heavy smoke",
      "url": "https://techcrunch.com/2026/07/17/zoox-issues-software-recall-after-a-robotaxi-got-confused-by-heavy-smoke/",
      "publishedAt": "2026-07-17",
      "sourceTier": "established_media",
      "sourceType": "article",
      "accessedAt": "2026-07-27"
    }
  ],
  "sections": [],
  "evidenceBoundary": "NHTSA落地页未直接展示Part 573正文；详细过程由TechCrunch引用监管文件和Zoox声明补充。",
  "relatedWorks": [
    "robotaxi"
  ],
  "promoteToHome": false,
  "presentation": "brief",
  "brief": {
    "subject": "Zoox软件召回",
    "statement": "Zoox因车辆在浓烟应急场景中的处理问题，对105辆车实施软件召回。",
    "sourceRefs": ["source-nhtsa-zoox", "source-techcrunch-zoox"],
    "isOpinion": false
  }
}
