{
  "id": "observation-xpeng-employee-robotaxi-test",
  "slug": "xpeng-employee-robotaxi-test",
  "status": "published",
  "level": "standard",
  "nature": "evidence-led",
  "title": "小鹏Robotaxi从技术展示进入员工端到端服务测试",
  "summary": "小鹏称已打通下单、调度、接驾和完单链路，但当前仍是内部测试，并不等于公众商业运营成立。",
  "companies": [
    "XPENG"
  ],
  "regions": [
    "中国广州"
  ],
  "dimensions": [
    "产品与能力",
    "运营与市场"
  ],
  "primaryDimension": "产品与能力",
  "eventAt": "2026-07-10",
  "publishedAt": "2026-07-28",
  "updatedAt": "2026-07-28",
  "factOverview": [
    {
      "label": "测试性质",
      "value": "员工内部测试"
    },
    {
      "label": "服务链",
      "value": "下单、调度、接驾、载客、完单"
    },
    {
      "label": "公开运营",
      "value": "尚未证实"
    }
  ],
  "rangeAndFacts": {
    "id": "range-and-facts",
    "heading": "范围与事实",
    "paragraphs": [
      "XPENG宣布启动Robotaxi员工测试，并称首个内部乘客完成从下单、接驾、自动调度、载客到完单的端到端行程。"
    ],
    "evidenceUnitIds": [
      "evidence-xpeng-test",
      "evidence-xpeng-chain"
    ]
  },
  "operatingImpact": {
    "id": "operating-impact",
    "heading": "经营影响",
    "paragraphs": [
      "这表明XPENG开始验证Robotaxi服务链，而不仅是车辆功能；员工测试仍不能证明公众运营、安全规模或商业模式成立。"
    ],
    "evidenceUnitIds": [
      "evidence-xpeng-impact"
    ]
  },
  "evidenceUnits": [
    {
      "id": "evidence-xpeng-test",
      "claim": "XPENG于2026年7月10日宣布启动Robotaxi员工测试。",
      "claimKind": "company_statement",
      "sourceRefs": [
        "source-xpeng-release"
      ]
    },
    {
      "id": "evidence-xpeng-chain",
      "claim": "XPENG称内部首趟行程打通下单、调度、接驾、载客和完单链路。",
      "claimKind": "company_statement",
      "sourceRefs": [
        "source-xpeng-release"
      ]
    },
    {
      "id": "evidence-xpeng-impact",
      "claim": "该测试意味着公司开始验证完整服务链，但不等于公众商业运营成立。",
      "claimKind": "inference",
      "sourceRefs": [
        "source-xpeng-release"
      ]
    }
  ],
  "sources": [
    {
      "id": "source-xpeng-release",
      "publisher": "XPENG / PR Newswire",
      "title": "From Smart EVs to autonomous vehicles: XPENG positions Robotaxi as a key milestone in bringing Physical AI to the real world",
      "url": "https://www.prnewswire.com/news-releases/from-smart-evs-to-autonomous-vehicles-xpeng-positions-robotaxi-as-a-key-milestone-in-bringing-physical-ai-to-the-real-world-302822753.html",
      "publishedAt": "2026-07-10",
      "sourceTier": "primary",
      "sourceType": "official_statement",
      "accessedAt": "2026-07-27"
    }
  ],
  "sections": [],
  "evidenceBoundary": "仅有公司新闻稿；未披露车队规模、服务区域、安全员配置和测试指标。",
  "relatedWorks": [
    "robotaxi"
  ],
  "promoteToHome": false,
  "presentation": "brief",
  "brief": {
    "subject": "小鹏Robotaxi",
    "statement": "小鹏宣布启动Robotaxi员工测试，并称已打通下单、调度、接驾、载客和完单链路。",
    "sourceRefs": ["source-xpeng-release"],
    "isOpinion": false
  }
}
