{
  "id": "observation-zoox-nhtsa-paid-robotaxi-exemption",
  "slug": "zoox-nhtsa-paid-robotaxi-exemption",
  "status": "published",
  "level": "standard",
  "nature": "evidence-led",
  "title": "Zoox收费载客的联邦门槛获推进",
  "summary": "AP报道NHTSA已批准Zoox临时豁免；州和地方许可、收费日期与投放规模仍未确认。",
  "companies": [
    "Zoox"
  ],
  "regions": [
    "美国拉斯维加斯"
  ],
  "dimensions": [
    "准入与政策",
    "运营与市场"
  ],
  "primaryDimension": "准入与政策",
  "eventAt": "2026-07-30",
  "publishedAt": "2026-07-31",
  "updatedAt": "2026-07-31",
  "factOverview": [
    {
      "label": "联邦进展",
      "value": "AP报道NHTSA批准临时豁免"
    },
    {
      "label": "车辆类型",
      "value": "无人工驾驶控制的专用Robotaxi"
    },
    {
      "label": "仍需条件",
      "value": "州和地方运营批准"
    }
  ],
  "rangeAndFacts": {
    "id": "range-and-facts",
    "heading": "范围与事实",
    "paragraphs": [
      "AP报道，NHTSA已向Zoox的专用自动驾驶车辆授予临时豁免；在取得州和地方批准后，Zoox可向乘客收费。"
    ],
    "evidenceUnitIds": [
      "evidence-zoox-ap-federal-exemption",
      "evidence-zoox-federal-register-application"
    ]
  },
  "operatingImpact": {
    "id": "operating-impact",
    "heading": "经营影响",
    "paragraphs": [
      "这解决的是专用Robotaxi与传统人工驾驶车辆标准之间的联邦合规门槛，不等同于任何城市已经开始收费运营。"
    ],
    "evidenceUnitIds": [
      "evidence-zoox-operating-impact"
    ]
  },
  "evidenceUnits": [
    {
      "id": "evidence-zoox-ap-federal-exemption",
      "claim": "美联社报道，NHTSA已批准Zoox专用自动驾驶车辆的临时豁免；其在取得州和地方批准后可向乘客收费。",
      "claimKind": "media_report",
      "sourceRefs": [
        "source-ap-zoox-federal-exemption"
      ]
    },
    {
      "id": "evidence-zoox-federal-register-application",
      "claim": "联邦公报记录显示，Zoox申请临时豁免以免除其专用自动驾驶车辆的八项联邦机动车安全标准部分要求；该申请涉及无人工驾驶控制的车辆。",
      "claimKind": "verified_fact",
      "sourceRefs": [
        "source-federal-register-zoox-application"
      ]
    },
    {
      "id": "evidence-zoox-operating-impact",
      "claim": "联邦临时豁免处理车辆合规问题；州和地方许可、收费日期和投放规模尚未由本组来源确认，因此不能据此认定Zoox已在任何城市收费运营。",
      "claimKind": "inference",
      "sourceRefs": [
        "source-ap-zoox-federal-exemption",
        "source-federal-register-zoox-application"
      ]
    }
  ],
  "sources": [
    {
      "id": "source-ap-zoox-federal-exemption",
      "publisher": "The Associated Press",
      "title": "Some robotaxis approved to operate without steering wheels and losing the brake pedal could be next",
      "url": "https://apnews.com/article/1bdb3bb8ecc80a23721504315cfa50ce",
      "publishedAt": "2026-07-30",
      "sourceTier": "established_media",
      "sourceType": "article",
      "accessedAt": "2026-07-31"
    },
    {
      "id": "source-federal-register-zoox-application",
      "publisher": "Federal Register / NHTSA",
      "title": "Zoox—Receipt of Application for Temporary Exemption From Various Requirements of the Federal Motor Vehicle Safety Standards for an Automated Driving System-Equipped Vehicle; Request for Comment",
      "url": "https://www.govinfo.gov/app/details/FR-2026-03-11/2026-04730",
      "publishedAt": "2026-03-11",
      "sourceTier": "primary",
      "sourceType": "report",
      "accessedAt": "2026-07-31"
    }
  ],
  "sections": [],
  "evidenceBoundary": "已确认的是AP对联邦临时豁免的报道，以及Zoox曾就八项联邦机动车安全标准部分要求提出申请。未直接定位NHTSA最终决定公告；州和地方运营许可、收费开始日期、车辆数量、价格和实际收费运营均未由本组来源确认。",
  "relatedWorks": [
    "robotaxi"
  ],
  "promoteToHome": false,
  "presentation": "brief",
  "brief": {
    "subject": "Zoox联邦豁免",
    "body": "美联社报道，NHTSA已批准Zoox的临时豁免：这类没有方向盘和人工制动控制的专用Robotaxi，在取得州和地方批准后可以向乘客收费。关键不是“车辆已全面商用”，而是联邦车辆标准这一关被打开；收费日期、城市许可和首批规模仍待明确。",
    "sourceRefs": [
      "source-ap-zoox-federal-exemption",
      "source-federal-register-zoox-application"
    ],
    "isOpinion": false
  }
}
