{
  "id": "observation-waymo-freeway-construction-zone-recall",
  "slug": "waymo-freeway-construction-zone-recall",
  "status": "published",
  "level": "standard",
  "nature": "evidence-led",
  "title": "Waymo施工区事件后限制高速公路驾驶并启动召回",
  "summary": "NHTSA报告记录Waymo在施工区事件后实施高速公路驾驶限制，并于6月决定召回第五代ADS。",
  "companies": [
    "Waymo",
    "NHTSA"
  ],
  "regions": [
    "美国旧金山湾区"
  ],
  "dimensions": [
    "安全与事件",
    "产品与能力"
  ],
  "primaryDimension": "安全与事件",
  "eventAt": "2026-05-18",
  "publishedAt": "2026-07-30",
  "updatedAt": "2026-07-30",
  "factOverview": [
    {
      "label": "事件",
      "value": "7辆车进入封闭施工车道"
    },
    {
      "label": "即时动作",
      "value": "限制高速公路驾驶"
    },
    {
      "label": "后续监管文件",
      "value": "NHTSA 26E035召回报告"
    }
  ],
  "rangeAndFacts": {
    "id": "range-and-facts",
    "heading": "范围与事实",
    "paragraphs": [
      "NHTSA Part 573报告记载，5月18日7辆Waymo车辆在旧金山湾区驶入由锥桶封闭的高速公路施工车道；Waymo随后限制高速公路驾驶。"
    ],
    "evidenceUnitIds": [
      "evidence-waymo-events",
      "evidence-waymo-restriction"
    ]
  },
  "operatingImpact": {
    "id": "operating-impact",
    "heading": "经营影响",
    "paragraphs": [
      "6月决定的召回涉及第五代ADS的软件和运营协议改进，反映施工区识别问题会直接影响可运行范围。"
    ],
    "evidenceUnitIds": [
      "evidence-waymo-recall"
    ]
  },
  "evidenceUnits": [
    {
      "id": "evidence-waymo-events",
      "claim": "NHTSA报告记载，2026年5月18日有7辆Waymo车辆在旧金山湾区驶入活动施工区域的封闭车道。",
      "claimKind": "verified_fact",
      "sourceRefs": [
        "source-nhtsa-26e035"
      ]
    },
    {
      "id": "evidence-waymo-restriction",
      "claim": "Waymo Field Safety Committee随后实施高速公路驾驶限制，直至识别并处理根因。",
      "claimKind": "verified_fact",
      "sourceRefs": [
        "source-nhtsa-26e035"
      ]
    },
    {
      "id": "evidence-waymo-recall",
      "claim": "Waymo于6月决定召回，6月17日提交的NHTSA报告列出3,871套潜在涉及的第五代ADS，并说明软件与运营协议改进。",
      "claimKind": "verified_fact",
      "sourceRefs": [
        "source-nhtsa-26e035"
      ]
    }
  ],
  "sources": [
    {
      "id": "source-nhtsa-26e035",
      "publisher": "美国国家公路交通安全管理局",
      "title": "Part 573 Safety Recall Report 26E035",
      "url": "https://static.nhtsa.gov/odi/rcl/2026/RCLRPT-26E035-7637.pdf",
      "publishedAt": "2026-06-17",
      "sourceTier": "primary",
      "sourceType": "report",
      "accessedAt": "2026-07-30"
    }
  ],
  "sections": [],
  "evidenceBoundary": "报告确认事件、限制与召回决定；不确认发生过碰撞、伤亡或财产损失，3,871也不是发生事件的车辆数，补救部署完成时间尚未确认。",
  "relatedWorks": [
    "robotaxi"
  ],
  "promoteToHome": false,
  "presentation": "brief",
  "brief": {
    "subject": "Waymo施工区召回",
    "body": "NHTSA报告记录：5月18日，7辆Waymo车辆在旧金山湾区驶入有锥桶封闭的高速施工车道。Waymo随后限制高速公路驾驶，6月决定召回涉及3,871套第五代ADS并计划软件与运营协议改进。报告没有确认碰撞、伤亡或补救已部署。",
    "sourceRefs": [
      "source-nhtsa-26e035"
    ],
    "isOpinion": false
  }
}
