{
  "id": "observation-weride-uber-zurich-plan",
  "slug": "weride-uber-zurich-plan",
  "status": "published",
  "level": "standard",
  "nature": "evidence-led",
  "title": "WeRide与Uber计划在苏黎世推出Robotaxi服务",
  "summary": "WeRide与Uber宣布计划在大苏黎世地区推出Robotaxi服务，预计今年晚些时候经Uber app提供，仍取决于监管批准。",
  "companies": [
    "WeRide",
    "Uber",
    "Rydera"
  ],
  "regions": [
    "瑞士大苏黎世地区"
  ],
  "dimensions": [
    "合作与扩张",
    "运营与市场",
    "准入与政策"
  ],
  "primaryDimension": "合作与扩张",
  "eventAt": "2026-06-17",
  "publishedAt": "2026-07-30",
  "updatedAt": "2026-07-30",
  "factOverview": [
    {
      "label": "区域",
      "value": "瑞士大苏黎世地区"
    },
    {
      "label": "当前状态",
      "value": "计划推出"
    },
    {
      "label": "预计时间",
      "value": "2026年晚些时候"
    },
    {
      "label": "车队运营",
      "value": "Rydera拟负责日常运营"
    }
  ],
  "rangeAndFacts": {
    "id": "range-and-facts",
    "heading": "范围与事实",
    "paragraphs": [
      "WeRide与Uber于6月17日宣布计划在大苏黎世地区推出Robotaxi服务，预计今年晚些时候经Uber app提供，仍取决于监管批准；当地伙伴Rydera拟负责车队日常运营。"
    ],
    "evidenceUnitIds": [
      "evidence-weride-zurich-plan",
      "evidence-weride-zurich-operations"
    ]
  },
  "operatingImpact": {
    "id": "operating-impact",
    "heading": "经营影响",
    "paragraphs": [
      "公告显示技术提供方、平台和本地车队运营方的责任分工，但它描述的是拟议部署，不能证明服务已向公众开放、已收费或已转为全无人商业运营。"
    ],
    "evidenceUnitIds": [
      "evidence-weride-zurich-operating-boundary"
    ]
  },
  "evidenceUnits": [
    {
      "id": "evidence-weride-zurich-plan",
      "claim": "WeRide与Uber于2026年6月17日宣布计划在大苏黎世地区推出Robotaxi服务，预计今年晚些时候经Uber app提供，前提是获得监管批准。",
      "claimKind": "company_statement",
      "sourceRefs": [
        "source-weride-zurich-plan"
      ]
    },
    {
      "id": "evidence-weride-zurich-operations",
      "claim": "WeRide称当地伙伴Rydera将管理苏黎世车队的日常运营。",
      "claimKind": "company_statement",
      "sourceRefs": [
        "source-weride-zurich-plan"
      ]
    },
    {
      "id": "evidence-weride-zurich-operating-boundary",
      "claim": "公告描述的是拟议部署与计划，不能证明公众服务、收费运营或全无人商业运营已经开始。",
      "claimKind": "inference",
      "sourceRefs": [
        "source-weride-zurich-plan"
      ]
    }
  ],
  "sources": [
    {
      "id": "source-weride-zurich-plan",
      "publisher": "WeRide / GlobeNewswire",
      "title": "WeRide and Uber Plan to Launch Commercial Robotaxi Service in Zurich, Expanding European Partnership",
      "url": "https://ir.weride.ai/node/8981/pdf",
      "publishedAt": "2026-06-17",
      "sourceTier": "primary",
      "sourceType": "official_statement",
      "accessedAt": "2026-07-30"
    }
  ],
  "sections": [],
  "evidenceBoundary": "来源为WeRide公司公告。已确认的是计划、预期时间、监管前提和所称运营分工；未确认服务启动日期、测试或运营范围、车队规模、收费、乘客资格、全无人运行状态或实际经营结果。publishedAt与updatedAt仅记录候选生成日期，不表示已公开发布。",
  "relatedWorks": [
    "robotaxi"
  ],
  "promoteToHome": false,
  "presentation": "brief",
  "brief": {
    "subject": "WeRide苏黎世计划",
    "body": "WeRide与Uber于6月17日宣布计划在大苏黎世地区推出Robotaxi服务，预计今年晚些时候经Uber app提供，仍取决于监管批准；Rydera拟负责车队日常运营。这是拟议部署，不代表服务已开放、已收费或已转为全无人商业运营。",
    "sourceRefs": [
      "source-weride-zurich-plan"
    ],
    "isOpinion": false
  }
}
