{
  "id": "observation-baidu-apollo-go-q1-2026-update",
  "slug": "baidu-apollo-go-q1-2026-update",
  "status": "published",
  "level": "standard",
  "nature": "evidence-led",
  "title": "Baidu披露Apollo Go一季度全无人运营订单增长",
  "summary": "Baidu披露Apollo Go一季度完成320万次全无人运营订单，运营数据来自公司内部管理记录。",
  "companies": [
    "Baidu",
    "Apollo Go"
  ],
  "regions": [
    "全球"
  ],
  "dimensions": [
    "运营与市场",
    "合作与扩张",
    "经营与资本"
  ],
  "primaryDimension": "运营与市场",
  "eventAt": "2026-05-18",
  "publishedAt": "2026-07-30",
  "updatedAt": "2026-07-30",
  "factOverview": [
    {
      "label": "一季度全无人订单",
      "value": "320万次"
    },
    {
      "label": "同比",
      "value": "增长超过120%"
    },
    {
      "label": "数据性质",
      "value": "公司内部管理记录"
    }
  ],
  "rangeAndFacts": {
    "id": "range-and-facts",
    "heading": "范围与事实",
    "paragraphs": [
      "Baidu披露，Apollo Go一季度完成320万次全无人运营订单，同比增长超过120%，3月单周峰值超过35万次；截至4月面向公众的累计订单超过2,200万次。"
    ],
    "evidenceUnitIds": [
      "evidence-baidu-q1-rides",
      "evidence-baidu-cumulative-rides"
    ]
  },
  "operatingImpact": {
    "id": "operating-impact",
    "heading": "经营影响",
    "paragraphs": [
      "订单与里程表明公司披露的运营规模继续扩大，但城市footprint不等于每城均已商业开放，也不能推出业务收入或盈利。"
    ],
    "evidenceUnitIds": [
      "evidence-baidu-footprint-boundary"
    ]
  },
  "evidenceUnits": [
    {
      "id": "evidence-baidu-q1-rides",
      "claim": "Baidu披露Apollo Go在2026年第一季度完成320万次全无人运营订单，同比增长超过120%，3月单周峰值超过35万次。",
      "claimKind": "company_statement",
      "sourceRefs": [
        "source-baidu-q1-2026"
      ]
    },
    {
      "id": "evidence-baidu-cumulative-rides",
      "claim": "Baidu披露截至2026年4月Apollo Go面向公众提供的累计订单超过2,200万次。",
      "claimKind": "company_statement",
      "sourceRefs": [
        "source-baidu-q1-2026"
      ]
    },
    {
      "id": "evidence-baidu-footprint-boundary",
      "claim": "Baidu披露截至2026年5月全球footprint达到27座城市；该口径不说明每座城市处于测试、试运营或商业运营中的哪一阶段。",
      "claimKind": "company_statement",
      "sourceRefs": [
        "source-baidu-q1-2026"
      ]
    }
  ],
  "sources": [
    {
      "id": "source-baidu-q1-2026",
      "publisher": "Baidu Inc.",
      "title": "Baidu Announces First Quarter 2026 Results",
      "url": "https://baidu.gcs-web.com/news-releases/news-release-details/baidu-announces-first-quarter-2026-results",
      "publishedAt": "2026-05-18",
      "sourceTier": "official",
      "sourceType": "official_statement",
      "accessedAt": "2026-07-30"
    }
  ],
  "sections": [],
  "evidenceBoundary": "所有运营数字来自Baidu未审计的内部管理记录；不能把27城footprint写为27城商业开放，也不能由订单或里程推断Apollo Go收入、成本、利用率或盈利。",
  "relatedWorks": [
    "robotaxi"
  ],
  "promoteToHome": false,
  "presentation": "brief",
  "brief": {
    "subject": "Apollo Go运营规模",
    "body": "Baidu披露Apollo Go一季度完成320万次全无人运营订单，同比增逾120%，截至4月累计面向公众订单逾2,200万次；5月全球footprint为27城。上述运营数据来自公司内部管理记录，不能据此推断各城市均已商业开放、业务收入或盈利。",
    "sourceRefs": [
      "source-baidu-q1-2026"
    ],
    "isOpinion": false
  }
}
