{
  "id": "observation-robotaxi-boundary",
  "slug": "robotaxi-simulation-boundary",
  "status": "published",
  "level": "brief",
  "nature": "opinion-led",
  "title": "Robotaxi 作品首先要证明的，不是页面数量",
  "summary": "一个经营模拟作品的可信度，来自对象、规则、事实和反馈是否形成闭环，也来自它是否诚实说明模拟与真实运营之间的边界。",
  "companies": [],
  "regions": [],
  "dimensions": ["产品与能力"],
  "primaryDimension": "产品与能力",
  "publishedAt": "2026-07-24",
  "updatedAt": "2026-07-25",
  "factOverview": [
    { "label": "观察范围", "value": "Robotaxi 经营模拟作品" },
    { "label": "内容性质", "value": "作者判断" },
    { "label": "主要维度", "value": "产品与能力" }
  ],
  "rangeAndFacts": {
    "id": "range-and-facts",
    "heading": "范围与事实",
    "paragraphs": [
      "Robotaxi 经营闭环模拟平台用于验证我如何把经营问题转成业务架构、B 端产品、数据对象和可运行工程，并通过持续迭代检查这些层次是否一致。"
    ],
    "evidenceUnitIds": ["evidence-robotaxi-purpose"]
  },
  "operatingImpact": {
    "id": "operating-impact",
    "heading": "经营影响",
    "paragraphs": [
      "它可以证明认知迁移、产品设计、数据与系统实现以及 AI 协作能力，但不能证明真实城市运营、自动驾驶核心技术或真实企业经营结果。"
    ],
    "evidenceUnitIds": ["evidence-robotaxi-boundary"]
  },
  "sections": [],
  "evidenceUnits": [
    {
      "id": "evidence-robotaxi-purpose",
      "claim": "该作品用于验证经营问题到业务架构、B 端产品、数据对象和可运行工程的转换。",
      "claimKind": "opinion",
      "sourceRefs": ["source-robotaxi-project-snapshot"]
    },
    {
      "id": "evidence-robotaxi-boundary",
      "claim": "模拟作品不能证明真实城市运营、自动驾驶核心技术或真实企业经营结果。",
      "claimKind": "opinion",
      "sourceRefs": ["source-robotaxi-project-snapshot"]
    }
  ],
  "sources": [
    {
      "id": "source-robotaxi-project-snapshot",
      "publisher": "Robotaxi 项目",
      "title": "Robotaxi 项目定位、代码和运行结果的网站表达快照",
      "url": "https://robotaxi.xingbuild.top/",
      "publishedAt": "2026-07-24",
      "sourceTier": "internal_snapshot",
      "sourceType": "internal_snapshot",
      "accessedAt": "2026-07-25"
    }
  ],
  "evidenceBoundary": "基于 Robotaxi 项目定位、代码和运行结果形成的网站表达快照；不扩大为真实城市运营或真实企业经营结果。",
  "relatedWorks": ["robotaxi"],
  "promoteToHome": true
}
