{
  "id": "observation-california-dmv-av-regulations",
  "slug": "california-dmv-av-regulations",
  "status": "published",
  "level": "brief",
  "nature": "evidence-led",
  "title": "加州DMV采纳新自动驾驶法规并强化安全监督",
  "summary": "California DMV采纳新的自动驾驶法规，增加测试门槛、第一响应者互动、应急地理围栏和数据报告等监督要求。",
  "companies": [
    "California DMV"
  ],
  "regions": [
    "美国加州"
  ],
  "dimensions": [
    "准入与政策",
    "安全与事件"
  ],
  "primaryDimension": "准入与政策",
  "eventAt": "2026-04-28",
  "publishedAt": "2026-08-02",
  "updatedAt": "2026-08-02",
  "factOverview": [
    {
      "label": "监管动作",
      "value": "正式采纳新自动驾驶法规"
    },
    {
      "label": "安全要求",
      "value": "第一响应者互动与应急地理围栏"
    },
    {
      "label": "适用范围",
      "value": "加州自动驾驶车辆测试与部署"
    }
  ],
  "rangeAndFacts": {
    "id": "range-and-facts",
    "heading": "范围与事实",
    "paragraphs": [
      "California DMV于4月28日宣布采纳新的自动驾驶法规，公告列出阶段性测试里程门槛、第一响应者响应、应急地理围栏以及车辆里程和安全数据报告等要求。"
    ],
    "evidenceUnitIds": [
      "evidence-cadm-av-regulations"
    ]
  },
  "operatingImpact": {
    "id": "operating-impact",
    "heading": "经营影响",
    "paragraphs": [
      "加州把应急互动、数据报告和测试门槛写入更明确的监督框架，可能影响自动驾驶企业的测试准备和许可节奏；该公告本身不改变任何特定运营商的许可状态。"
    ],
    "evidenceUnitIds": [
      "evidence-cadm-av-regulations"
    ]
  },
  "evidenceUnits": [
    {
      "id": "evidence-cadm-av-regulations",
      "claim": "California DMV于4月28日宣布采纳新AV法规，包含阶段性测试门槛、30秒第一响应者响应、应急地理围栏和车辆里程及安全数据报告等要求。",
      "claimKind": "verified_fact",
      "sourceRefs": [
        "source-cadm-av-regulations"
      ]
    }
  ],
  "sources": [
    {
      "id": "source-cadm-av-regulations",
      "publisher": "California Department of Motor Vehicles",
      "title": "New Autonomous Vehicle Regulations Strengthen Oversight and Enforcement, Authorize Trucks and Transit",
      "url": "https://www.dmv.ca.gov/portal/news-and-media/new-autonomous-vehicle-regulations-strengthen-oversight-and-enforcement-authorize-trucks-and-transit/",
      "publishedAt": "2026-04-28",
      "sourceTier": "official",
      "sourceType": "official_statement",
      "accessedAt": "2026-08-02"
    }
  ],
  "sections": [],
  "evidenceBoundary": "可确认法规采纳及公告列明的规则方向和门槛；不能据此推定任何特定公司已取得新许可或已改变运营范围。",
  "relatedWorks": [
    "robotaxi"
  ],
  "promoteToHome": false,
  "presentation": "brief",
  "brief": {
    "subject": "加州AV监管",
    "body": "California DMV于4月28日宣布采纳新的自动驾驶法规，强化阶段性测试门槛、第一响应者互动、应急地理围栏以及车辆里程和安全数据报告。规则把安全监督与运营准备连接得更紧，但这只是州级监管框架更新，不等于任何特定Robotaxi运营商已取得新许可，也不代表服务范围已经改变。",
    "sourceRefs": [
      "source-cadm-av-regulations"
    ],
    "isOpinion": false
  }
}
