{
  "id": "observation-uk-dft-automated-vehicle-trialling-code",
  "slug": "uk-dft-automated-vehicle-trialling-code",
  "status": "published",
  "level": "brief",
  "nature": "evidence-led",
  "title": "英国更新自动驾驶道路试验规范并明确安全监督要求",
  "summary": "英国DfT与CCAV更新自动驾驶试验规范，明确安全驾驶员、授权豁免和沟通要求；规范更新不等同于商业部署许可。",
  "companies": [
    "UK DfT",
    "CCAV"
  ],
  "regions": [
    "英国"
  ],
  "dimensions": [
    "准入与政策",
    "安全与事件"
  ],
  "primaryDimension": "准入与政策",
  "eventAt": "2026-06-24",
  "publishedAt": "2026-08-02",
  "updatedAt": "2026-08-02",
  "factOverview": [
    {
      "label": "监管动作",
      "value": "更新自动驾驶试验规范"
    },
    {
      "label": "安全要求",
      "value": "安全驾驶员持续监控道路和系统"
    },
    {
      "label": "边界",
      "value": "试验规范不等于商业部署许可"
    }
  ],
  "rangeAndFacts": {
    "id": "range-and-facts",
    "heading": "范围与事实",
    "paragraphs": [
      "英国DfT与CCAV于6月24日更新自动驾驶试验规范，要求安全驾驶员监控道路和车辆系统，并说明授权、豁免及与主管部门沟通的要求。"
    ],
    "evidenceUnitIds": [
      "evidence-uk-av-trial-code"
    ]
  },
  "operatingImpact": {
    "id": "operating-impact",
    "heading": "经营影响",
    "paragraphs": [
      "该规范把公开道路试验的安全责任、授权沟通和豁免边界写得更清楚，为英国道路验证提供统一参照；它不是商业部署许可，不能直接推导运营商已获准收费服务。"
    ],
    "evidenceUnitIds": [
      "evidence-uk-av-trial-code"
    ]
  },
  "evidenceUnits": [
    {
      "id": "evidence-uk-av-trial-code",
      "claim": "DfT与CCAV于6月24日更新自动驾驶试验规范，要求安全驾驶员监控道路和车辆系统，并说明授权、豁免及与部门沟通要求。",
      "claimKind": "verified_fact",
      "sourceRefs": [
        "source-uk-av-code-2026"
      ]
    }
  ],
  "sources": [
    {
      "id": "source-uk-av-code-2026",
      "publisher": "UK Department for Transport / CCAV",
      "title": "Automated vehicle trialling code of practice",
      "url": "https://www.gov.uk/government/publications/trialling-automated-vehicle-technologies-in-public/code-of-practice-automated-vehicle-trialling",
      "publishedAt": "2026-06-24",
      "sourceTier": "official",
      "sourceType": "official_statement",
      "accessedAt": "2026-08-02"
    }
  ],
  "sections": [],
  "evidenceBoundary": "可确认公开试验规范的更新内容；不能据此推断任何企业已获商业运营批准。",
  "relatedWorks": [
    "robotaxi"
  ],
  "promoteToHome": false,
  "presentation": "brief",
  "brief": {
    "subject": "英国试验规范",
    "body": "英国DfT与CCAV更新自动驾驶道路试验规范，要求安全驾驶员持续监控道路和车辆系统，并明确授权、豁免以及与主管部门沟通的要求。它为英国公开道路验证提供了更清晰的安全边界，也补充了此前准入政策观察，但仍只是试验规范，不是商业部署许可，不能据此宣称任何企业已获准收费运营。",
    "sourceRefs": [
      "source-uk-av-code-2026"
    ],
    "isOpinion": false
  }
}
