{
  "id": "observation-pony-zagreb-commercial-robotaxi",
  "slug": "pony-zagreb-commercial-robotaxi",
  "status": "published",
  "level": "brief",
  "nature": "evidence-led",
  "title": "Pony.ai称在萨格勒布启动商业Robotaxi服务",
  "summary": "公司称服务覆盖市中心及机场约90平方公里；车队规模、订单量与当地许可文件未披露。",
  "companies": [
    "Pony.ai",
    "Uber",
    "Verne"
  ],
  "regions": [
    "克罗地亚萨格勒布"
  ],
  "dimensions": [
    "合作与扩张",
    "运营与市场",
    "准入与政策"
  ],
  "primaryDimension": "合作与扩张",
  "eventAt": "2026-04-08",
  "publishedAt": "2026-08-01",
  "updatedAt": "2026-08-01",
  "factOverview": [
    {
      "label": "服务阶段",
      "value": "公司称已启动商业服务"
    },
    {
      "label": "初始范围",
      "value": "市中心及机场约90平方公里"
    },
    {
      "label": "服务时间",
      "value": "每日07:00–21:00"
    }
  ],
  "rangeAndFacts": {
    "id": "range-and-facts",
    "heading": "范围与事实",
    "paragraphs": [
      "Pony.ai公告称，其与Uber、Verne已在克罗地亚萨格勒布启动商业Robotaxi服务，初始覆盖市中心及机场约90平方公里，可通过Verne app预约。"
    ],
    "evidenceUnitIds": [
      "evidence-pony-zagreb-start",
      "evidence-pony-zagreb-scope"
    ]
  },
  "operatingImpact": {
    "id": "operating-impact",
    "heading": "经营影响",
    "paragraphs": [
      "这是一项城市级服务启动的公司披露，不足以证明服务已实现规模化或盈利；车队、订单和当地许可文件仍未公开。"
    ],
    "evidenceUnitIds": [
      "evidence-pony-zagreb-boundary"
    ]
  },
  "evidenceUnits": [
    {
      "id": "evidence-pony-zagreb-start",
      "claim": "Pony.ai公告称其与Uber、Verne已在萨格勒布启动商业Robotaxi服务。",
      "claimKind": "company_statement",
      "sourceRefs": [
        "source-pony-zagreb-release"
      ]
    },
    {
      "id": "evidence-pony-zagreb-scope",
      "claim": "公告称服务初始覆盖市中心及机场约90平方公里，每日07:00–21:00，可通过Verne app预约。",
      "claimKind": "company_statement",
      "sourceRefs": [
        "source-pony-zagreb-release"
      ]
    },
    {
      "id": "evidence-pony-zagreb-boundary",
      "claim": "车队规模、订单量与当地许可文件未在该公告中披露，因此不能据此判断服务规模或盈利。",
      "claimKind": "inference",
      "sourceRefs": [
        "source-pony-zagreb-release"
      ]
    }
  ],
  "sources": [
    {
      "id": "source-pony-zagreb-release",
      "publisher": "Pony AI Inc.",
      "title": "PONY AI Inc. Advances Overseas Deployment with Launch of Europe’s First Commercial Robotaxi Service in Zagreb, Croatia",
      "url": "https://ir.pony.ai/node/8161/pdf",
      "publishedAt": "2026-04-08",
      "sourceTier": "official",
      "sourceType": "official_statement",
      "accessedAt": "2026-08-01"
    }
  ],
  "sections": [],
  "evidenceBoundary": "已确认的是Pony.ai官方公告中的服务启动、合作方、初始范围与服务时间。该公告未披露车队规模、订单量、当地许可文件或盈利数据，不能据此推导全城覆盖、规模化或盈利。",
  "relatedWorks": [
    "robotaxi"
  ],
  "promoteToHome": false,
  "presentation": "brief",
  "brief": {
    "subject": "Pony.ai萨格勒布",
    "body": "Pony.ai称，其与Uber、Verne在萨格勒布启动商业Robotaxi服务，初始覆盖市中心及机场约90平方公里，每日运营07:00–21:00，可通过Verne app预约。Uber接入尚待后续；车队规模、订单量和当地许可文件均未披露，因此不能据此判断服务规模或盈利。",
    "sourceRefs": [
      "source-pony-zagreb-release"
    ],
    "isOpinion": false
  }
}
